{
  "id": "kafka-event",
  "name": "Kafka Event Message",
  "category": "messaging",
  "description": "Apache Kafka event message consumed from a topic",
  "authTypes": ["bearer", "mtls", "none"],
  "defaultAuthType": "none",
  "examplePayload": {
    "event_type": "service.health.degraded",
    "event_id": "evt_7x9k2m4p8q3n5r1t",
    "timestamp": "2026-07-24T14:30:00.000Z",
    "version": "1.0",
    "source": {
      "service": "payment-api",
      "environment": "production",
      "region": "us-east-1",
      "instance_id": "i-0a1b2c3d4e5f67890"
    },
    "severity": "critical",
    "category": "availability",
    "data": {
      "health_check": {
        "endpoint": "/health",
        "status_code": 503,
        "response_time_ms": 8500,
        "error_message": "Database connection pool exhausted"
      },
      "metrics": {
        "error_rate": 0.45,
        "success_rate": 0.55,
        "avg_response_time_ms": 3200,
        "active_connections": 0,
        "queued_requests": 127
      }
    },
    "metadata": {
      "correlation_id": "req_abc123def456ghi789",
      "trace_id": "trace_xyz987uvw654rst321",
      "kafka_topic": "service-events",
      "kafka_partition": 3,
      "kafka_offset": 142857
    }
  },
  "payloadSchema": {
    "type": "object",
    "required": ["event_type", "timestamp", "data"],
    "properties": {
      "event_type": {"type": "string"},
      "severity": {"enum": ["info", "warning", "error", "critical"]},
      "timestamp": {"type": "string", "format": "date-time"}
    }
  },
  "documentation": "https://kafka.apache.org/documentation/#messages",
  "tags": ["kafka", "messaging", "event-streaming", "distributed"]
}
